<?xml version="1.0" encoding="UTF-8"?>
<publisher xmlns="http://www.javacream.org/publisher" xmlns:xsi="http://www.w3.org/2001/XMLSchema-instance" xsi:schemaLocation="http://www.javacream.org/publisher publisher.xsd " name="Springer" city="Berlin">
	<book>
		<isbn>ISBN1</isbn>
		<title>Java in Action</title>
		<price>19.99</price>
	</book>
	<book>
		<isbn>ISBN2</isbn>
		<title>Apache Commons</title>
		<price>9.99</price>
	</book>
	<book>
		<isbn>ISBN3</isbn>
		<title>Spring Framework</title>
		<price>25.99</price>
	</book>
</publisher>

